{
  "$schema": "http://json-schema.org/draft-07/schema#",
  "$id": "stockbotv2/intermediate_format/0.1",
  "title": "Engine A extraction intermediate format (DB-agnostic)",
  "description": "extract.py for each document outputs one JSON in this format. The loader merges into Neo4j.",
  "type": "object",
  "required": [
    "schema_version",
    "source_doc",
    "sources",
    "nodes",
    "edges"
  ],
  "additionalProperties": false,
  "properties": {
    "schema_version": {
      "type": "string"
    },
    "_note": {
      "type": "string"
    },
    "_comment": {
      "type": "string"
    },
    "source_doc": {
      "type": "object",
      "required": [
        "doc_id",
        "title",
        "source_type",
        "evidence_tier"
      ],
      "additionalProperties": false,
      "properties": {
        "doc_id": {
          "type": "string"
        },
        "title": {
          "type": "string"
        },
        "url": {
          "type": [
            "string",
            "null"
          ]
        },
        "origin_entity": {
          "type": [
            "string",
            "null"
          ],
          "description": "哪家公司/機構發出此文件（發出方，不是被分析方）。L8 來源獨立性鐵律的核心欄位。"
        },
        "publisher": {
          "type": [
            "string",
            "null"
          ]
        },
        "published_at": {
          "type": [
            "string",
            "null"
          ]
        },
        "retrieved_at": {
          "type": [
            "string",
            "null"
          ]
        },
        "storage_permission": {
          "enum": [
            "repo_full",
            "repo_excerpt",
            "local_only",
            null
          ],
          "description": "依內容授權與雲端保存權決定的 Git storage class；Phase I 舊 corpus 可為 null。"
        },
        "permission_basis": {
          "type": [
            "string",
            "null"
          ],
          "description": "storage_permission 的人工可讀依據；Phase I 舊 corpus 可為 null。"
        },
        "source_type": {
          "enum": [
            "filing",
            "transcript",
            "ir_deck",
            "industry_report",
            "paper",
            "news",
            "social",
            "teardown",
            "datasheet"
          ]
        },
        "evidence_tier": {
          "type": "integer",
          "minimum": 1,
          "maximum": 4
        },
        "section": {
          "type": [
            "string",
            "null"
          ],
          "description": "同一 canonical URL 文件被刻意拆成多段抽取時，標記此段（如 financials / photonics）。同 URL 的多個 doc 需各自 section 非空且互不相同才算合法多段，否則視為靜默重複。"
        },
        "supersedes_extraction_sha256": {
          "type": [
            "string",
            "null"
          ],
          "pattern": "^[0-9a-f]{64}$",
          "description": "具名更正走廊（2026-09-11）：本份 extraction 要取代的**那一版**的 canonical hash。必須等於現存檔案的 hash——不能說「取代現在那份，不管它是什麼」。舊版由 intake/provenance.publish_provenance 歸檔到 extractions/superseded/，**兩份都留**。未填時 no-clobber 照舊：任何改寫都會被判成 conflict。"
        },
        "origin_linkage": {
          "enum": [
            "same_origin",
            "independent",
            null
          ],
          "description": "媒體文是不是轉述同一個 origin_event（2026-10-01 Phase 4 Step 4.2c）：same_origin＝轉述／改寫新聞稿；independent＝自己採訪或統計；不確定不填或 null。字彙住 schema/vocab.json origin_linkage。"
        }
      }
    },
    "sources": {
      "type": "array",
      "items": {
        "type": "object",
        "required": [
          "id",
          "locator"
        ],
        "additionalProperties": false,
        "properties": {
          "id": {
            "type": "string"
          },
          "locator": {
            "type": "string"
          },
          "quote": {
            "type": [
              "string",
              "null"
            ]
          }
        }
      }
    },
    "nodes": {
      "type": "array",
      "items": {
        "type": "object",
        "required": [
          "id",
          "type",
          "name",
          "abstraction_level",
          "confidence",
          "source_ids"
        ],
        "additionalProperties": false,
        "properties": {
          "id": {
            "type": "string",
            "pattern": "^[a-z]+:[a-z0-9_\\-]+$"
          },
          "type": {
            "enum": [
              "Company",
              "Product",
              "TechNode",
              "Material",
              "Standard",
              "Person"
            ]
          },
          "name": {
            "type": "string"
          },
          "abstraction_level": {
            "enum": [
              "end_demand",
              "deployment_workflow",
              "robot_system",
              "robot_subsystem",
              "network_systems",
              "module_subsystem",
              "device_chip",
              "test_yield",
              "foundry_packaging",
              "equipment_epitaxy",
              "materials_substrate"
            ]
          },
          "role": {
            "enum": [
              "leader",
              "robot_oem",
              "robot_operator",
              "robot_component_supplier",
              "bottleneck_supplier",
              "disruptor",
              "foundry",
              "test",
              "network",
              "adjacent_silicon",
              "material_base",
              null
            ]
          },
          "aliases": {
            "type": "array",
            "items": {
              "type": "string"
            }
          },
          "attributes": {
            "type": "object",
            "properties": {
              "ramp_difficulty_intrinsic": {
                "type": [
                  "integer",
                  "null"
                ],
                "minimum": 1,
                "maximum": 5
              },
              "concentration_score": {
                "type": [
                  "integer",
                  "null"
                ],
                "minimum": 1,
                "maximum": 5
              },
              "intrinsic_cycle_time_weeks": {
                "type": [
                  "integer",
                  "null"
                ],
                "minimum": 0,
                "description": "交易對手不變時仍成立的典型物理製程週期；當期實際交期不得放此欄。"
              }
            }
          },
          "confidence": {
            "type": "number",
            "minimum": 0,
            "maximum": 1
          },
          "source_ids": {
            "type": "array",
            "items": {
              "type": "string"
            },
            "minItems": 1
          }
        }
      }
    },
    "edges": {
      "type": "array",
      "items": {
        "type": "object",
        "required": [
          "id",
          "src_id",
          "dst_id",
          "relation",
          "confidence",
          "source_ids"
        ],
        "additionalProperties": false,
        "properties": {
          "id": {
            "type": "string"
          },
          "src_id": {
            "type": "string"
          },
          "dst_id": {
            "type": "string"
          },
          "relation": {
            "enum": [
              "supplies_to",
              "is_component_of",
              "is_variant_of",
              "develops",
              "deploys",
              "offered_under",
              "competes_with",
              "enables",
              "depends_on",
              "invests_in",
              "licenses_to",
              "about",
              "acquired",
              "partnership_with",
              "constrained_by"
            ]
          },
          "attributes": {
            "type": "object",
            "properties": {
              "substitutability": {
                "type": [
                  "integer",
                  "null"
                ],
                "minimum": 1,
                "maximum": 5
              },
              "sole_source": {
                "type": [
                  "boolean",
                  "null"
                ]
              },
              "lead_time_weeks": false,
              "structural_lead_time_weeks": {
                "type": [
                  "integer",
                  "null"
                ],
                "minimum": 0,
                "description": "特定供應關係在正常條件下的慢變典型交期；缺料或物流造成的當期實際交期應存為 dated Claim/Engine C observation。"
              },
              "qualification_status": {
                "enum": [
                  "none",
                  "sampling",
                  "qualifying",
                  "qualified",
                  "designed_in",
                  null
                ]
              },
              "ramp_execution": {
                "type": [
                  "integer",
                  "null"
                ],
                "minimum": 1,
                "maximum": 5
              },
              "control": {
                "type": [
                  "boolean",
                  "null"
                ],
                "description": "只用在 invests_in：這筆投資是不是控制（持股過半、合資共同控制、母子公司；逐字要寫得出比例或母子關係）。true 時雙方互為關係人，對方說的不算第三方印證。少數股權不填。"
              }
            }
          },
          "confidence": {
            "type": "number",
            "minimum": 0,
            "maximum": 1
          },
          "source_ids": {
            "type": "array",
            "items": {
              "type": "string"
            },
            "minItems": 1
          }
        }
      }
    },
    "claims": {
      "type": "array",
      "items": {
        "type": "object",
        "required": [
          "id",
          "statement",
          "subject_id",
          "demand_proof_level",
          "disproof_condition",
          "confidence",
          "source_ids"
        ],
        "additionalProperties": false,
        "properties": {
          "id": {
            "type": "string"
          },
          "statement": {
            "type": "string"
          },
          "subject_id": {
            "type": "string"
          },
          "demand_proof_level": {
            "enum": [
              "confirmed",
              "guided",
              "inferred",
              "speculative"
            ]
          },
          "disproof_condition": {
            "type": "string"
          },
          "confidence": {
            "type": "number",
            "minimum": 0,
            "maximum": 1
          },
          "source_ids": {
            "type": "array",
            "items": {
              "type": "string"
            },
            "minItems": 1
          }
        }
      }
    }
  }
}
