{
  "claims": [
    {
      "confidence": 0.75,
      "demand_proof_level": "inferred",
      "disproof_condition": "Lower substitutability when another ex-China producer reaches sustained commercial separated-REO production (e.g., MP heavy separation facility, Seadrift Texas plant, or Brazil ionic-clay projects ramp); this claim's uniqueness scope is time-stamped 2025-10-30 and must be rechecked each quarter.",
      "id": "lynas_q1_fy26_quarterly_2025_10_30_substitutability_cl1",
      "source_ids": [
        "lynas_q1_fy26_quarterly_2025_10_30_substitutability_s1"
      ],
      "statement": "Lynas self-describes as the only outside-China commercial producer of separated light and heavy rare earth oxides. Self-reported (L8), but structurally corroborated by USGS 2026: US net import reliance for heavy rare earths is 100% and terbium imports are 100% from China, and by Mining Weekly's report of first ex-China Tb oxide production at Lynas Malaysia. For ex-China magnet supply chains, substitutability judged 4/5 (not 5: within-China supply is abundant and other separation projects are funded and under construction).",
      "subject_id": "e_sub1"
    }
  ],
  "edges": [
    {
      "attributes": {
        "substitutability": 4
      },
      "confidence": 0.8,
      "dst_id": "mat:rare_earth_magnets",
      "id": "e_sub1",
      "relation": "supplies_to",
      "source_ids": [
        "lynas_q1_fy26_quarterly_2025_10_30_substitutability_s1"
      ],
      "src_id": "co:lynas"
    }
  ],
  "nodes": [
    {
      "abstraction_level": "materials_substrate",
      "aliases": [
        "LYC.AX"
      ],
      "attributes": {
        "ticker": "LYC.AX"
      },
      "confidence": 0.9,
      "id": "co:lynas",
      "name": "Lynas Rare Earths",
      "role": null,
      "source_ids": [
        "lynas_q1_fy26_quarterly_2025_10_30_substitutability_s1"
      ],
      "type": "Company"
    },
    {
      "abstraction_level": "materials_substrate",
      "aliases": [
        "NdFeB"
      ],
      "attributes": {},
      "confidence": 0.9,
      "id": "mat:rare_earth_magnets",
      "name": "Rare earth magnets (neodymium, samarium-cobalt)",
      "role": null,
      "source_ids": [
        "lynas_q1_fy26_quarterly_2025_10_30_substitutability_s1"
      ],
      "type": "Material"
    }
  ],
  "schema_version": "0.1",
  "source_doc": {
    "doc_id": "lynas_q1_fy26_quarterly_2025_10_30_substitutability",
    "evidence_tier": 1,
    "origin_entity": "Lynas Rare Earths",
    "permission_basis": "Public ASX filing; URL and short excerpts.",
    "published_at": "2025-10-30",
    "publisher": "ASX",
    "retrieved_at": "2026-09-01",
    "section": "ex_china_uniqueness",
    "source_type": "filing",
    "storage_permission": "repo_excerpt",
    "title": "Lynas Rare Earths Q1 FY26 Quarterly Activities Report",
    "url": "https://announcements.asx.com.au/asxpdf/20251030/pdf/06r89kkr64drjj.pdf"
  },
  "sources": [
    {
      "id": "lynas_q1_fy26_quarterly_2025_10_30_substitutability_s1",
      "locator": "Report intro — company positioning",
      "quote": "the only outside China commercial producer of separated Light and Heavy Rare Earth oxides"
    }
  ]
}
